,issn,abstract,LastName,FirstName,year
44,0022-1007,"THE FOLLOWING GENERAL CONCLUSIONS MAY BE DRAWN FROM THE PRECEDING WORK: Fibrin is altered by formaldehyde and is then less easily digested by pepsin and by trypsin. Papaïn is apparently unable to digest fibrin even when this is exposed to very weak formaldehyde (1:1000) for a very short time. The casein of milk, on contact with formaldehyde, undergoes rapid alteration and is as a result not coagulated by rennet, or but very slowly. Such altered casein, like similar fibrin, is not readily digested by the proteolytic ferments. The longer the formaldehyde acts on casein and on fibrin the more marked is the result. Pepsin is not affected by a one per cent solution of formaldehyde, even when the mixture has stood for four weeks. Even a five per cent solution of formaldehyde acting for three weeks has no effect on pepsin. Contrary results obtained by others are due to an alteration of the fibrin by the formaldehyde. A putrid solution of pepsin in distilled water one month old digests fibrin as readily as a fresh solution. Rennet is not affected even by a four per cent solution of formaldehyde acting for several weeks. The absence of coagulation at times is due to the action of formaldehyde on the casein of the milk and not on the rennet ferment. Papaïn is very quickly altered by formaldehyde, even in very dilute solution. Moreover, it is unable to digest fibrin that has been exposed to the action of a very dilute solution of formaldehyde for a short time. Trypsin is altered by formaldehyde to such an extent that digestion of fibrin will not take place, or but very slowly. The extent to which trypsin is affected by formaldehyde depends largely upon the amount of organic matter present, as well as on the amount of ferment in the solution. Amylopsin is not destroyed by very dilute solutions of formaldehyde, but stronger solutions decrease the activity of the ferment, and if used in sufficient concentration will destroy it completely. Ptyalin, like the diastatic ferment of the pancreas, is not destroyed by dilute solutions of formaldehyde. If the latter is used in rather strong concentration and allowed to act for some time it will destroy the ferment. The action of formaldehyde is more rapid and more marked at a slightly elevated temperature than at ordinary room temperature. Malt diastase, unlike the diastatic ferments of the saliva and pancreatic solution, is not destroyed by formaldehyde when this is used in moderate amount and at ordinary temperature. Unlike pepsin, a solution of malt diastase readily undergoes decomposition on standing even for one or more days. This destruction is undoubtedly due to bacteria since it does not take place when formaldehyde is present. Consequently the favoring action which formaldehyde apparently exerts on diastase really consists in the inhibition of the growth of micro-organisms, and hence the diastase is protected against decomposition.",Bliss,C L,1899
45,0022-1007,"THE FOLLOWING GENERAL CONCLUSIONS MAY BE DRAWN FROM THE PRECEDING WORK: Fibrin is altered by formaldehyde and is then less easily digested by pepsin and by trypsin. Papaïn is apparently unable to digest fibrin even when this is exposed to very weak formaldehyde (1:1000) for a very short time. The casein of milk, on contact with formaldehyde, undergoes rapid alteration and is as a result not coagulated by rennet, or but very slowly. Such altered casein, like similar fibrin, is not readily digested by the proteolytic ferments. The longer the formaldehyde acts on casein and on fibrin the more marked is the result. Pepsin is not affected by a one per cent solution of formaldehyde, even when the mixture has stood for four weeks. Even a five per cent solution of formaldehyde acting for three weeks has no effect on pepsin. Contrary results obtained by others are due to an alteration of the fibrin by the formaldehyde. A putrid solution of pepsin in distilled water one month old digests fibrin as readily as a fresh solution. Rennet is not affected even by a four per cent solution of formaldehyde acting for several weeks. The absence of coagulation at times is due to the action of formaldehyde on the casein of the milk and not on the rennet ferment. Papaïn is very quickly altered by formaldehyde, even in very dilute solution. Moreover, it is unable to digest fibrin that has been exposed to the action of a very dilute solution of formaldehyde for a short time. Trypsin is altered by formaldehyde to such an extent that digestion of fibrin will not take place, or but very slowly. The extent to which trypsin is affected by formaldehyde depends largely upon the amount of organic matter present, as well as on the amount of ferment in the solution. Amylopsin is not destroyed by very dilute solutions of formaldehyde, but stronger solutions decrease the activity of the ferment, and if used in sufficient concentration will destroy it completely. Ptyalin, like the diastatic ferment of the pancreas, is not destroyed by dilute solutions of formaldehyde. If the latter is used in rather strong concentration and allowed to act for some time it will destroy the ferment. The action of formaldehyde is more rapid and more marked at a slightly elevated temperature than at ordinary room temperature. Malt diastase, unlike the diastatic ferments of the saliva and pancreatic solution, is not destroyed by formaldehyde when this is used in moderate amount and at ordinary temperature. Unlike pepsin, a solution of malt diastase readily undergoes decomposition on standing even for one or more days. This destruction is undoubtedly due to bacteria since it does not take place when formaldehyde is present. Consequently the favoring action which formaldehyde apparently exerts on diastase really consists in the inhibition of the growth of micro-organisms, and hence the diastase is protected against decomposition.",Novy,F G,1899
46,0022-1007,"(1) An acute gonorrhoeal urethritis may be the starting point for a grave general septicaemia with all its possible complications. (2) These infections may be mixed or secondary, due to the entrance into the circulation of organisms other than the gonococcus, or they may be purely gonococcal in nature. (3) Endocarditis is an occasional complication of gonorrhoea. (4) This endocarditis may be transient, disappearing with but few apparent results, or it may leave the patient with a chronic valvular lesion, or it may pursue a rapidly fatal course with the symptoms of acute ulcerative endocarditis. (5) The endocarditis associated with gonorrhoea is commonly due to the direct action of the gonococcus, hut may be the result of a secondary or mixed infection. (6) Pericarditis may also occur as a complication of gonorrhoea, but it is less frequent than endocarditis. It may, as in the case of the latter, be the result either of a pure gonococcal or of a mixed infection. (7) Grave myocardial changes, necroses, purulent infiltration, embolic abscesses are common in the severe gonococcal septicaemias. (8) In instances of gonococcal septicaemia the diagnosis may, in some cases, be made during life by cultures taken from the circulating blood according to proper methods.",Thayer,W S,1899
47,0022-1007,"(1) An acute gonorrhoeal urethritis may be the starting point for a grave general septicaemia with all its possible complications. (2) These infections may be mixed or secondary, due to the entrance into the circulation of organisms other than the gonococcus, or they may be purely gonococcal in nature. (3) Endocarditis is an occasional complication of gonorrhoea. (4) This endocarditis may be transient, disappearing with but few apparent results, or it may leave the patient with a chronic valvular lesion, or it may pursue a rapidly fatal course with the symptoms of acute ulcerative endocarditis. (5) The endocarditis associated with gonorrhoea is commonly due to the direct action of the gonococcus, hut may be the result of a secondary or mixed infection. (6) Pericarditis may also occur as a complication of gonorrhoea, but it is less frequent than endocarditis. It may, as in the case of the latter, be the result either of a pure gonococcal or of a mixed infection. (7) Grave myocardial changes, necroses, purulent infiltration, embolic abscesses are common in the severe gonococcal septicaemias. (8) In instances of gonococcal septicaemia the diagnosis may, in some cases, be made during life by cultures taken from the circulating blood according to proper methods.",Lazear,J W,1899
48,0022-1007,"1. I have simplified the dilution method by using a stock glycerine emulsion of the virulent cord, from which the desired dilutions can be readily prepared. The proportion of glycerine should not exceed (1/5) part, if it is desired to retain the full virulence of the emulsion. 2. There is some danger of giving rabies to animals in the dilution immunization treatment, a danger which is not present in the Pasteur method. 3. The dried-cord method does not rest solely upon the principle of dilution, but is based also upon attenuation of the virus. 4. The Pasteur method being entirely free from the element of danger which pertains to the glycerine dilution method and resting upon a sounder experimental basis is the one to be preferred.",Cabot,F,1899
49,0022-1007,"(1) The application of the Nissl method to the study of the motor cells of the spinal cord, and the nerve cells of the dorsal root ganglia in typhoid fever, shows that these cells regularly suffer pathological changes in the course of the infection. (2) The alterations in the motor cells are more constant and of a severer grade than are those in the cells of the sensory ganglia. The more characteristic changes consist of disintegration, solution and destruction of the chromatic substance of the cell starting from the axone hillock and proceeding toward the nucleus. Coincidently the nuclei of the affected cells seek the periphery. Alterations are also suffered by the nucleus and nucleolus. (3) While this central form of ehromatolysis is the prevailing type of pathological change, disintegration, etc., of the Nissl bodies situated in the periphery of the cell and in the dendrites is also observed (peripheral chromatolysis). (4) In experimental infection with typhoid bacilli in rabbits a similar series of lesions in the corresponding nerve cells in the spinal cord and ganglia is encountered. (5) The main or central type of lesions discovered is identical with that found in man and animals after section, destruction, or even slight injury of the peripheral nerves. (6) The examination of the peripheral nerves arising from the lumbar segment of the cord (the site in man and rabbit of the most profound changes) in rabbits inoculated with typhoid bacilli showed well-marked evidences of parenchymatous degeneration. (7> It is probable that lesions of the peripheral nerves in typhoid fever in human beings are common and that the post-typhoid hyper sthesias and paralyses are due to this cause. (8) Restitution of the chromatic granules may take place in the affected nerve cells, the new formation beginning about the nucleus and extending through the protoplasm.",Nichols,J L,1899
50,0022-1007,"1. Tubercle bacilli when suspended in. distilled water, normal salt solution, bouillon and milk, are destroyed at 60 degrees C. in 15 to 20 minutes. The larger number are destroyed in 5 to 10 minutes. 2. When tubercle bacilli are suspended in milk, the pellicle which forms during the exposure at 60 degrees C. may contain living bacilli after 60 minutes.",Smith,T,1899
51,0022-1007,"1. As varying amounts of calcium oxalate may be held in solution in the urine, conclusions based upon the presence or number of calcium oxalate crystals found therein are of no real value as an indication of the quantity of oxalic acid present. 2. Unless the utmost care is exercised, the results obtained by quantitative estimation of oxalic acid are subject to large percentages of error. This is especially true in the use of Neubauer's or Shultzen's methods, in which the calcium oxalate is precipitated in an alkaline solution. 3. An ordinary mixed diet regularly contains traces of oxalic acid or its salts. 4. A portion of the oxalic acid ingested with the food may be absorbed and reappear unchanged in the urine. 5. The normal daily excretion of oxalic acid in the urine fluctuates with the amount taken in the food, and varies from a few milligrammes to two or three centigrammes, being usually below ten milligrammes. 6. In health, no oxalic acid, or only a trace, is formed in the body, but that present in the urine has been ingested with the food. 7. In certain clinical disturbances which in some of the cases studied above were associated with absence of free hydrochloric acid from the gastric juice, oxalic acid is formed in the organism. 8. This formation in the organism is connected with fermentative activity in the alimentary canal. (a) The prolonged feeding of dogs with excessive quantities of glucose, together with meat, leads eventually to a state of oxaluria. (6) This experimental oxaluria is associated with a mucous gastritis, and with absence of free hydrochloric acid in the gastric contents. (c) The oxaluria and the accompanying gastritis are referable to fermentation induced by the excessive feeding with sugar. (d) The experimental gastritis from fermentation is associated with the formation of oxalic acid in the gastric contents. 9. The symptoms attributed to an oxalic acid diathesis, with the exception of those due to local irritation in the genitourinary tract, do not appear to be due to the presence in the system of soluble oxalates, but are more likely to depend on other products of fermentation and putrefaction.",Baldwin,H,1900
52,0022-1007,"THE RESULTS OF THE FOREGOING EXPERIMENTS MAY BE BRIEFLY SUMMARIZED AS FOLLOWS: The amount of antitoxic substance obtained by precipitation with magnesium sulphate from the blood-serum of the horse corresponds, as nearly as can be determined by the use of test guinea-pigs, in full to the protective power of the serum from which it is obtained, i. e. the precipitate from 1 cc. of serum will protect against the same amount of toxin as 1 cc. of the serum itself. Equal amounts of the precipitates by magnesium sulphate from immunized and non-immunized horses act differently toward toxin; i. e. the proportion of protective substance to the precipitate from non-immunized serum is exceedingly small as compared with the proportion of antitoxin to the precipitate from sera of immunized horses. The average precipitate from the sera of immunized horses, as obtained by magnesium sulphate, is more abundant than the average precipitate from sera of non-immunized horses. In the case of the same animal before and after immunization, the serum before immunization gives a less abundant precipitate with magnesium sulphate than the serum tested after immunization. The proportion of increase per unit of antitoxic strength for the same or different horses is not constant. This may be due to an increase of inactive substances (in their relation to diphtheric toxin) or to imperfect methods of determination. The precipitates obtained by magnesium sulphate give all the reactions recognized as characteristic of globulins, and as distinguishing them from other albuminous bodies. We are not warranted, then, in the present state of our knowledge, in considering any part of these precipitates as other than globulin. But it does seem warrantable to conclude, from the fact that the globulins of normal serum do not protect, or only in comparatively large amounts, against diphtheric toxin, that new globulins are formed, or rather greatly increased in the serum of immunized horses, and that these globulins protect against the toxin. These increased globulins and the inert globulins (which from obvious causes are a very variable factor) are both precipitated by magnesium sulphate. Every animal has a physiological and pathological history more or less widely diverging from the normal, hence absolute conformity in the results obtained is not to be expected, at least with our present methods of differentiation.",Hiss,P H,1900
53,0022-1007,"THE RESULTS OF THE FOREGOING EXPERIMENTS MAY BE BRIEFLY SUMMARIZED AS FOLLOWS: The amount of antitoxic substance obtained by precipitation with magnesium sulphate from the blood-serum of the horse corresponds, as nearly as can be determined by the use of test guinea-pigs, in full to the protective power of the serum from which it is obtained, i. e. the precipitate from 1 cc. of serum will protect against the same amount of toxin as 1 cc. of the serum itself. Equal amounts of the precipitates by magnesium sulphate from immunized and non-immunized horses act differently toward toxin; i. e. the proportion of protective substance to the precipitate from non-immunized serum is exceedingly small as compared with the proportion of antitoxin to the precipitate from sera of immunized horses. The average precipitate from the sera of immunized horses, as obtained by magnesium sulphate, is more abundant than the average precipitate from sera of non-immunized horses. In the case of the same animal before and after immunization, the serum before immunization gives a less abundant precipitate with magnesium sulphate than the serum tested after immunization. The proportion of increase per unit of antitoxic strength for the same or different horses is not constant. This may be due to an increase of inactive substances (in their relation to diphtheric toxin) or to imperfect methods of determination. The precipitates obtained by magnesium sulphate give all the reactions recognized as characteristic of globulins, and as distinguishing them from other albuminous bodies. We are not warranted, then, in the present state of our knowledge, in considering any part of these precipitates as other than globulin. But it does seem warrantable to conclude, from the fact that the globulins of normal serum do not protect, or only in comparatively large amounts, against diphtheric toxin, that new globulins are formed, or rather greatly increased in the serum of immunized horses, and that these globulins protect against the toxin. These increased globulins and the inert globulins (which from obvious causes are a very variable factor) are both precipitated by magnesium sulphate. Every animal has a physiological and pathological history more or less widely diverging from the normal, hence absolute conformity in the results obtained is not to be expected, at least with our present methods of differentiation.",Atkinson,J P,1900
54,0022-1007,"1. The globulins of both normal and diphtheria antitoxic serum exhibit chemically toward reagents the same reactions, being precipitated by magnesium sulphate and split up into fractions in precisely the same way. 2. All of the diphtheric antitoxic power of both normal and immunized serum is always carried by the globulin and its fractional precipitates. 3. During the fractional precipitation of the serum globulin of horses immunized from diphtheria toxin and horses not immunized from diphtheria toxin, some of the globulin is lost, likewise at the same time some of the antitoxic power of the globulin of the immunized serum is lost. 4. These reactions, considered in connection with the fact that different observers as well as we ourselves have found diphtheric antitoxic power in normal horse's serum and that this antitoxin separates with the globulin, strongly incline us to consider ""diphtheria antitoxin"" a form of globulin. 5. The reactions of globulin, previously separated from the serum by magnesium sulphate, with sodium chloride lead one to think that there is a formation of globulin salts. 6. Since serum albumin in a magnesium sulphate solution gives fractional precipitates at definite temperatures, it seems not improbable that the albumin is precipitated in the form of albumin salts.",Atkinson,J P,1900
55,0022-1007,"In the case reported in this article there was septicaemia with special localization of the microorganisms in the brain, with gas cysts of the brain and general gaseous emphysema due to Bacillus mucosus capsulatus (aërogenes group). The bacillus isolated from the organs of this case, as well as other members of the aërogenic group of Bacillus mucosus capsulatus can cause general gaseous emphysema in the cadavers of rabbits, either with or without the intravenous injection of sugar before the animal is killed, the gas, however, being most abundant and rapidly formed in the former case. It is not impossible that some of the published cases of gaseous emphysema in which a bacteriological examination was not made, may have been due to members of the Bacillus mucosus capsulatus group.",Howard,W T,1900
56,0022-1007,"THE RESULTS OBTAINED IN THIS STUDY MAY BE BRIEFLY SUMMARIZED: 1. Acid-resisting bacilli are found in many of the lower animals, more especially the horse, cow, dog, guinea-pig and white rat. In the case of the rabbit and cat no such organisms were detected. 2. Many of these acid-resisting bacilli resemble the tubercle bacillus and the smegma bacillus of man. 3. The acid-resisting organisms are undoubtedly of different species and there is good reason to believe that the term smegma bacillus denotes not a definite species but rather a group of bacilli having common staining properties.",Cowie,D M,1900
57,0022-1007,"1. The several standard cultures used in this study are indistinguishable -a conclusion previously reached and stated by Flexner. 2. The acute dysentery of the United States is due to a bacillus indistinguishable from that obtained from the epidemics of dysentery in several other parts of the world. 3. The sporadic and the institutional outbreaks of acute dysentery are caused by the same microorganism, and this organism is identical with that causing epidemic acute dysentery. 4. The cause of acute dysentery, whether sporadic, institutional, or epidemic, is Bacillus dysenteriae Shiga.",Vedder,E B,1902
58,0022-1007,"1. The several standard cultures used in this study are indistinguishable -a conclusion previously reached and stated by Flexner. 2. The acute dysentery of the United States is due to a bacillus indistinguishable from that obtained from the epidemics of dysentery in several other parts of the world. 3. The sporadic and the institutional outbreaks of acute dysentery are caused by the same microorganism, and this organism is identical with that causing epidemic acute dysentery. 4. The cause of acute dysentery, whether sporadic, institutional, or epidemic, is Bacillus dysenteriae Shiga.",Duval,C W,1902
59,0022-1007,"The epidemics we have observed, were due to the presence and growth in the frogs of Bacillus hydrophilus fuscus. This was proved by recovering the bacillus in pure culture from the body fluids of frogs sick or dead of the disease, and the inoculation of healthy frogs with an emulsion of the pure culture, and by obtaining the same clinical picture and pathological findings as in the original diseased frogs; and, finally, by recovering the bacillus in pure culture from frogs inoculated and sick or dying as a result of the inoculation. The disease is widely distributed throughout North America and Europe, and in this country and Canada is known as ""red-leg."" It has been observed by us chiefly in the warm weather of September and October. The disease is characterized by congestion of the ventral surfaces of the body, with more or less ulceration in, and haemorrhage beneath, the skin, bloating due to serous exudation into the lymph sacs, gradual failure to respond to stimuli, which symptoms are followed by coma and death, the last being occasionally preceded by tetanic seizures. After death haemorrhages into the muscles and degenerative changes in the muscles, spleen, liver, and, to a slight degree, in the intestinal tract, are found. The blood shows an advanced degree of anaemia and leucocytosis. Predisposing causes of the disease are lesions of the skin, which seem to be the usual portal of entry of the infection, and lowered resistance from heat and from anaemia. By a series of controlled experiments with inoculated frogs we have shown that, while temperatures a little above freezing have no harmful effect upon the frogs, they completely control all manifestations of the disease in inoculated or diseased frogs, if the frogs are left in the cold for a period as long as seven days; and, further, that even short periods in the cold chamber will bring about a delay of the fatal results in diseased or inoculated frogs. The anaemia so often found in apparently healthy frogs seems in many cases to be due to the presence in the lungs of the frog of a parasite, the Distomum cylindraceum, which, occurring in sufficiently large numbers in an individual frog, is capable of materially diminishing the available supply of red corpuscles. Severe laking of the blood, the presence of numerous isolated red-cell nuclei, and great diminution in the number, or almost total absence of the red cells in the diseased frogs, are in proportion to the severity of the infection and due to bacterial action. The presence of the haematozoan parasite, the Drepanidium, does not play any part as a predisposing or exciting cause of the disease. The ascarid Rhabdomena nigrovenosum, although frequently present as a parasite in the lungs of the frogs, plays no part in causing or promoting the disease.",Emerson,H,1905
