,issn,abstract,LastName,FirstName,year
23,0022-1007,"The experiments described in Part IV of this paper show that in whatever manner the problem of the relation of the vagus to the accelerators is approached, whether the accelerators are stimulated during a stimulation of the vagus, or the vagus during a stimulation of the accelerators, or both are stimulated simultaneously, either for a short or for a longer period, the result is the same, viz., the effect upon the rate of the heart is determined entirely by the relative strength of the stimuli applied to the two nerves. If the stimuli are of approximately the same strength, as judged by the effect of stimulating the nerves separately, the rate of the heart is but slightly affected; if the stimulus applied to the vagus is the stronger, the heart is slowed; if it is weaker, the heart is accelerated. In all cases the result of stimulating the two nerves simultaneously is approximately the algebraic sum of the results of stimulating them separately; sometimes the inhibitory effect slightly predominates, but not more frequently than does the accelerator effect. Moreover, the two nerves may be stimulated simultaneously for a considerable period of time without either completely overcoming the effect of the other. Thus as far as their effect upon the rate of the ventricular beat is concerned, the vagus and accelerator nerves seem to be purely antagonistic; the statement that a minimal stimulation of the one can completely overcome a maximal stimulation of the other is undoubtedly incorrect, and the hypotheses as to the mode of action of these nerves upon the heart, based upon this statement, lose their chief support.",Hunt,R,1897
24,0022-1007,"Colostrum corpuscles are not always found in so-called colostrum milk; when they are present, the percentage of proteids is higher; as they disappear, the proteid percentage drops. The color of colostrum milk is yellow; this color is especially marked in negroes' milk (observed in four cases not included in this report). The reaction of colostrum milk is alkaline. The specific gravity varies from 1024 to 1034. This variation is chiefly due to the variation in the amount of fat present.",Woodward,G,1897
25,0022-1007,"In summing up the contents of the preceding pages it may be stated that the action of digitalis has been divided into two stages according to the changes evinced by the ventricles under its influence; of these the first is characterized by marked inhibitory action together with modification of the cardiac muscle, while in the second the inhibitory action is less marked and the muscular action becomes the more prominent feature. The inhibitory action is due to direct stimulation by this series of the pneumogastric centrally in the medulla oblongata and peripherally in the heart. The extent to which the inhibitory mechanism is stimulated varies in different animals and with different members of the digitalis series. The muscular action of small quantities betrays itself in a tendency to increase the extent of the contraction, while in some cases the degree of relaxation reached in diastole is also lessened by it. In larger quantities the series increases the irritability of the cardiac muscle very considerably, and the spontaneous rhythm of the ventricles therefore becomes developed. Through the interaction of these two factors in the first stage the rhythm of the whole heart is slowed, the contraction of the ventricle is more complete, and the diastolic relaxation is generally increased, although it may be unchanged or lessened. The systolic pressure is increased and the fall from maximum to minimum pressure is slower than normal owing to the increased completeness and longer duration of systole (Rolleston). The auricles generally contract with less force and may relax more completely than normally. Sometimes, however, their contractions also are more complete than before the injection of the drug. This latter condition generally precedes the diminution of the force of the auricular contraction. This variation of the effects of digitalis in the auricle explains the changes in intra-auricular pressure noted by Kaufmann. The contraction volume of the ventricles is always much increased, and the output per unit of time is generally augmented, and this together with the contraction of the peripheral arterioles causes an increase in the tension in the systemic circulation, an acceleration of the circulation, and possibly a temporary increase in the pressure in the great veins and in the auricle and ventricle in diastole (Kaufmann). The pressure in the pulmonary artery is practically unaffected by some members of the series, while by others it is considerably increased. This difference in the reaction of the pulmonary circulation is due to the varying extent to which these drugs act on the peripheral arteries and not to any difference in their action on the two sides of the heart. If the inhibitory action be very strongly marked the slowing of the heart may be extreme, the ventricles assuming their own spontaneous rhythm and all connection with the auricles being lost. While the contraction volume of the ventricle is still greater than normal, their output per unit of time may become less than normal, the aortic tension therefore fall and the rapidity of the circulation be lessened. The ventricles maintain their association throughout, and probably the rhythm of the two auricles also remains equal. The ventricular rhythm, however, becomes irregular owing to the variation in the duration of the diastolic pause. The auricles may cease altogether in diastole, or may continue to beat with a slower or faster rhythm than the ventricles. During the second stage the rhythm of the heart becomes accelerated owing to the increased irritability of the heart muscle. The ventricle tends to assume a rapid spontaneous rhythm, while the auricular rhythm is also quicker than in the first stage. When these two rhythms interfere by the passage of impulses across the auriculo-ventricular boundary in either direction, irregularity of the heart is produced, generally bearing a distinctly periodic character. The ventricles continue to maintain their common rhythm, while the auricles and ventricles may contract at quite different rates. The two ventricles, however, do not necessarily contract with equal force, and the contractions of one may present periodic variations in strength, while those of the other may be almost perfectly uniform. The contractions of the auricles vary in the same way as regards each other and the ventricles. The inhibitory nerves are no longer able to slow the ventricular rhythm, but may affect the completeness of systole and diastole in the ordinary way. The auricular contractions can still be lessened in force and possibly be abolished by their stimulation, and the impulses passing between the auricle and ventricle may therefore be blocked and regularity of the heart produced by powerful inhibition. The irregularity of the contractions is therefore due indirectly to the increased irritability of the cardiac muscle and the acceleration must be attributed to the same cause. An extreme phase of this stage produced by the interference of the rhythms is a temporary standstill of one of the chambers, generally the auricle. The irregularity leads to a lessened efficiency of the work of the heart. The output varies extremely in successive observations and the contraction volume of every individual beat may differ. The various chambers often show a tendency to dilate during this stage. The blood pressure in the systemic arteries at first remains high, in fact may be higher than in the first stage owing to the increased rapidity of the heart rhythm, but afterwards falls continuously as the periodic variations become shorter in duration. The auricles generally cease contracting before the ventricles, but not invariably. There is no fixed order in the cessation of the ventricles or auricles. Each division comes to a standstill in a position somewhat nearer diastole than systole and then passes into delirium and dilates to the fullest extent.",Cushny,A R,1897
26,0022-1007,"FROM OUR OBSERVATIONS I THINK THE FOLLOWING PROPOSITIONS ARE JUSTIFIED: (1) All muscular movements are made up of a series of elementarycontractions and relaxations in alternation, which may be appreciable as tremor in conditions of both health and disease. (2) The differences between different tremors are of degree rather than of kind, i. e. no one form of tremor is distinctive of any one disease or group of diseases. (3) No definite relation exists between one form of tremor and any other. (4) The frequency of movement is in inverse ratio to the amplitnde and vice versâ. (5) Habitual movements are performed with greater freedom from tremor than unusual movements. (6) There is no material difference between the movements of the two sides of the body, except as related to Proposition (5).",Eshner,A A,1897
27,0022-1007,"THE CONCLUSIONS AT WHICH WE ARRIVE ARE THE FOLLOWING: 1. Nodular enlargement of the tube can be caused by a number of different pathological conditions. 2. Clinical examination does not enable us to make a diagnosis of the pathological condition existing in an individual case of nodule of the tube. 3. The diagnosis of the nature of a tubal nodule can be made only with the microscope. 4. The conditions causing nodular enlargement of the tube are congenital or acquired, non-inflammatory or inflammatory. 5. Any one of these conditions can exist without the production of nodules. 6. The nodules can be found in all parts of the tube and-taking the peculiar anatomy of each part of the tube into account-show the same structure. 7. The enlargement can be caused by epithelial or epithelioid formations, connective or muscular tissue, by round-cell infiltrations or combinations of two or more of these. 8. The epithelial formations originate in the epithelium of a. the tubal mucous membrane (salpingitis pseudo-follicularis, adenomyoma originating in the tubal epithelium). b. the accessory tubes (intraparietal parasalpinx and hydro-parasalpinx). c. remnants of the Wolffian body (adenomyoma). 9. The epithelioid formations originate in the peritoneal endothelium (peritoneal growths under ""relative heterotopy""). 10. The excess of formation of connective tissue is a consequence of inflammatory conditions of the tubal wall (salpingitis interstitialis, Zweifel). 11. The hypertrophy of the muscular tissue is a. non-inflammatory (adenomyoma). b. consequent upon inflammation-Kaltenbach's case (23). 12. The accumulations of round cells are direct evidence of inflammation: a. non-specific (salpingitis interstitialis disseminata, salpingitis abscedens); or b. specific (salpingitis tuberculosa or s. gonorrhoica). 13. The epithelioid formations can occur wherever pseudo-membranes cover organs lined with a serous coat. 14. Extra-uterine pregnancy (abdominal or tubal) produces epithelioid formations by causing pseudo-membranes to form-not by any irritation peculiar to the pregnancy.",Ries,E,1897
28,0022-1007,"1. The cause of the rhythmic contraction of the ventricle lies within the ventricle itself. 2. The cause of the rhythmic contraction is not a single, localized, co-ordination centre; the co-ordination mechanism, whatever it may be, is present in all parts of the ventricle. 3. The integrity of the whole ventricle is not essential to the coordinated contractions of a part of the ventricle. 4. The apex of the mammalian heart possesses spontaneous, rhythmic contractility. 5. Assuming that the general belief in the absence of nerve cells from the apical part of the ventricle is correct, these experiments demonstrate that nerve cells are not essential to spontaneous, long-continued, co-ordinated contractions of the ventricle.",Porter,W T,1897
29,0022-1007,"1. The claim of L. Pfeiffer that small granular amoeboid bodies are present in the blood of vaccinated children and calves, and in the blood from cases of variola, during the stage of fever is confirmed. A nucleus has not been positively made out in any of these bodies. 2. Granular amoeboid bodies, having a diameter about one-third that of a red blood cell, appear, also, in the blood of the monkey during the active stage of vaccinia and disappear with the decline of the local inflammation. 3. A body of like appearance, granulation and size may occasionally be found in the normal blood of monkeys and children. 4. Pale amoeboid bodies, containing a few dark pigment-like granules, are present in the blood from cases of variola and in the blood of the variolated monkey. Bodies of like appearance may occasionally be found in the blood of vaccinated children and monkeys.",Reed,W,1897
30,0022-1007,"Assuming the typical colon bacillus and the typical typhoid bacillus to represent the types of this group that present the greatest divergences in biological peculiarities, we conclude, as others also have done, that there is a series of closely related forms that may be regarded as intermediate or transitional and which serve to establish a biological relationship, either near or remote, between these two typical members. From our own studies we are inclined to regard the typical colon bacillus as the type of this group, for the reason that its functional equilibrium, as observed in the intestine, is so permanent a quality that it may readily be perpetuated under what is ordinarily regarded as favorable artificial circumstances, and that with the continuance of such conditions there is no conspicuous tendency on the part of this organism to deviate from what we regard as its norm; whereas, on the other hand, with all the other members of this group with which we have worked, there is not only a lack of uniformity in the adjustment of the functions, but such as exists is readily disturbed under artificial environment; though it must be borne in mind that even with the typical colon bacillus we have also shown functional modifications to be possible under particular conditions. When the members of the colon group are cultivated under circumstances favorable to the development of both the function of fermentation and that of proteolysis, fermentation invariably takes precedence and no evidence of proteolysis is manifested until after fermentation has ceased. The cultivation of all the members of the colon group under circumstances that favor the development of one function, viz. that of proteolysis, at the expense of another, viz. that of fermentation, results first in an apparent increase of vigor; but this is of temporary duration and is quickly followed by the decline and death of the cell. The result of this increased activity of the proteolytic function is the formation of much larger amounts of indol by typical colon cultures than has ever been obtained by us by any other method. By the method of experimentation through which we were enabled to accentuate the proteolytic activity of the typical colon bacillus, as caused by an increase of indol formation, we have also induced the function of indol formation not only in atypical colon bacilli that had been devoid of it, but in every specimen of typical typhoid bacilli to which we had access as well. We feel justified in regarding one of the differential tests between the typhoid and colon bacillus, namely that of indol formation on the part of the latter and the absence of this function from the former, as of questionable value, for the reason, as shown above, that by particular methods of cultivation indol production has been shown to accompany the development of a number of specimens that we have every reason to regard as genuine typhoid bacilli. As a result of our own experiments, together with the observations of others, there can be no doubt that the bacillus coli communis at times possesses pathogenic properties, and that by artificial methods of treatment it may often be brought from a condition of benignity to one of virulence. The spleen of a typhoid patient has always been regarded as the only trustworthy source from which to obtain the typical typhoid bacillus. While we believe this to be true, still our investigations show that other members of the colon group may also be present in this viscus; in fact, from such spleens we have isolated practically all of the varieties of this group with which we are acquainted. From our experience, the value of the serum test for the differentiation of typhoid and colon bacilli would seem to be questionable. We are inclined, however, to attribute the irregularities recorded above as due more to the method of application than to defects of the principles involved; for, as stated, by the use of dried blood, as in our experiments, it is not possible to make the test with constant and accurate, or even approximately accurate, dilutions of the serum. Our irregularities may be in part due to this defect. We therefore lay less stress upon this than upon the other features of our work.",Peckham,A W,1897
31,0022-1007,"The action of aconitin on the dog's heart, therefore, seems to consist in: 1. A stimulation of the inhibitory mechanism, especially of the centres in the medulla oblongata. 2. An increase in the irritability of the muscle of the auricle and the ventricle, which leads to independent contractions of one or both of these divisions and culminates in fibrillary contractions in the ventricle. The first of these is the only effect seen in the therapeutic use of the drug, and aconitin may, therefore, be considered to be indicated when it is desirable to stimulate the inhibitory centre without acting on the heart muscle. Of course it has a further effect on the circulation through the stimulation of the vaso-motor centre, but this would appear to be of minor importance.",Matthews,S A,1897
32,0022-1007,"THE RESULTS AND CONCLUSIONS OF THE ABOVE INVESTIGATION ARE: 1. The term glio-sarcoma should be dropped, as unscientific and misleading in its significance. 2. The problems regarding neuroglia demand varied methods for their adequate study. 3. With all the means at our command, the absolute determination of the relation of cells and fibres in individual cases remains difficult and at times impossible. 4. No criterion has yet been offered to determine a fundamental distinction between glioma and sarcoma (Stroebe); and secondly, between glioma and so-called gliosis (Weigert). 5. The development of neuroglia in all probability is from cells with protoplasmic processes to cells with differentiated and independent fibres. 6. Herein lies a possible reconciliation of the conflicting views concerning the ultimate structure of human neuroglia.",Taylor,E W,1897
33,0022-1007,"1. It must be accepted from a comparison between the histological changes described in the focal necroses due to abrin and ricin, diphtheria, eclampsia, blood-serum intoxication, typhoid fever, lobar pneumonia and glanders, and those described here in three cases of tuberculosis, that the last are also instances of focal necrosis. 2. It may be claimed that the areas of necrosis in the three cases of tuberculosis had their origin in ischaemia, for the reason that they were numerous in the spleen and were not found in the kidney. Against such an explanation of their causation are the facts: that other forms of necrosis affect frequently the spleen and seldom the kidney; that thrombosis of vessels or any fixed relation of the areas in the spleen to blood-vessels could not be established; that the tubercle bacilli were invariably present; and lastly and of no slight importance, that these necroses were all present in cases of marked marasmus. 3. That the areas of necrosis in these three cases might be phenomena resulting from a mixed infection with pyogenic bacteria is possible, but no groups, colonies or even single bodies could be found which answered to the requirements in shape or staining properties for such bacteria. Even were it the case that the focal necroses here presented are the histological lesions of a septicaemia occurring as a complication of tuberculosis, the presence of the bacillus of tuberculosis in the areas of necrosis would still require explanation. 4. Lastly, it is not unreasonable to suppose that a diminished resistance on the part of the tissues incidental to marasmus is an important factor in the production of these necrotic lesions.",Le Count,E R,1897
34,0022-1007,"Semi-solid culture media, and more especially media rendered semi-solid by temperatures of from 30 degrees to 40 degrees C., seem to have an important bearing in the differentiation of bacterial species, particularly those presenting various degrees of motility. In such media not only the effect of differences in consistence on the motility of an organism may be noted, but the effect produced by various chemicals and nutrient ingredients on the growth and motility may be readily observed. By systematically varying the constituents of such media it has been possible to produce a medium in which the behavior of Bacillus typhosus differentiates it from the various members of the colon group; and also to produce a medium in which the colonies of Bacillus typhosus assume a form which distinguishes them from the colonies of the colon bacilli in plate cultures. Bacillus typhosus alone of all the organisms investigated during these experiments has displayed both the power of giving rise to thread-forming colonies in the plating medium and that of the uniform clouding of the tube medium, hence these two characters may prove to be of great value in the identification of this organism. The practical application of the use of these media has led to the ready detection of Bacillus typhosus and its isolation from the stools of patients suffering from typhoid fever. No suspected water has been subjected to test, but from the investigation of artificially infected tap-water the media here described may be assumed to have an application in the detection of Bacillus typhosus in such waters.",Hiss,P H,1897
35,0022-1007,"1. The proteids consisted of albumins and globulins, varying in quantity between the extremes of .9010 grm. and .2592 grm. in the 24 hours, but usually between .7 and .37 grm., the average being .5317 grm. 2. The quantity of the proteids varies directly as the urea, inversely as the external temperature. The relation between the quantity of urine and the quantity of proteid is not constant. The quantity of the proteida is little affected by diuretics; it tends to be increased by certain drugs that act upon the circulation. It is lessened during sleep. It is apt to suffer a sudden temporary increase, returning as suddenly to the usual average. For this phenomenon we have no explanation. 3. From .5449 to .6616 grm. of coagulable proteids a day (.0079 to .0094 grm. per kilo of body-weight) may be excreted through the urine for an indefinite time by an otherwise healthy individual without damage to either kidneys or organism.",Sollmann,T,1898
36,0022-1007,"1. The proteids consisted of albumins and globulins, varying in quantity between the extremes of .9010 grm. and .2592 grm. in the 24 hours, but usually between .7 and .37 grm., the average being .5317 grm. 2. The quantity of the proteids varies directly as the urea, inversely as the external temperature. The relation between the quantity of urine and the quantity of proteid is not constant. The quantity of the proteida is little affected by diuretics; it tends to be increased by certain drugs that act upon the circulation. It is lessened during sleep. It is apt to suffer a sudden temporary increase, returning as suddenly to the usual average. For this phenomenon we have no explanation. 3. From .5449 to .6616 grm. of coagulable proteids a day (.0079 to .0094 grm. per kilo of body-weight) may be excreted through the urine for an indefinite time by an otherwise healthy individual without damage to either kidneys or organism.",McComb,E C,1898
